{
  "protocol": "ahsp/1.0",
  "report_id": "018f5b40-2222-7222-8222-222222222222",
  "sequence": 4,
  "sent_at": "2026-10-21T18:05:00.000Z",
  "harness": {
    "instance_id": "018f5b30-0000-7000-8000-000000000001",
    "name": "build-box",
    "version": "0.1.0",
    "pid": 4242,
    "process_mode": "service",
    "uptime_secs": 300,
    "stopping": false,
    "config_fingerprint": "a1b2c3d4e5f6"
  },
  "host": { "hostname": "build-box", "os": "linux", "arch": "x86_64", "processes": [] },
  "runs": [
    {
      "run_id": "018f5b3e-aaaa-7aaa-8aaa-aaaaaaaaaaaa",
      "parent_run_id": null,
      "root_run_id": "018f5b3e-aaaa-7aaa-8aaa-aaaaaaaaaaaa",
      "depth": 0,
      "name": "coder",
      "mode": "plan",
      "status": "running",
      "phase": "join",
      "iteration": 0,
      "max_iterations": 8,
      "task_sha256_12": "0123456789ab",
      "task_title": "Fix the login redirect",
      "spec_id": "coder",
      "started_at": "2026-10-21T18:04:00.000Z",
      "finished_at": null,
      "error_kind": null,
      "children": [
        { "run_id": "018f5b3e-bbbb-7bbb-8bbb-bbbbbbbbbbbb", "name": "survey", "status": "succeeded", "depth": 0 },
        { "run_id": "018f5b3e-cccc-7ccc-8ccc-cccccccccccc", "name": "read_a", "status": "running", "depth": 0 },
        { "run_id": "018f5b3e-dddd-7ddd-8ddd-dddddddddddd", "name": "read_b", "status": "running", "depth": 0 }
      ],
      "tool_use": { "spawn_subagents": 2 }
    },
    {
      "run_id": "018f5b3e-bbbb-7bbb-8bbb-bbbbbbbbbbbb",
      "parent_run_id": "018f5b3e-aaaa-7aaa-8aaa-aaaaaaaaaaaa",
      "root_run_id": "018f5b3e-aaaa-7aaa-8aaa-aaaaaaaaaaaa",
      "depth": 0,
      "name": "survey",
      "mode": "react",
      "status": "succeeded",
      "phase": "react",
      "iteration": 2,
      "max_iterations": 8,
      "task_sha256_12": "fedcba987654",
      "task_title": "Survey the auth middleware",
      "spec_id": "coder",
      "started_at": "2026-10-21T18:04:10.000Z",
      "finished_at": "2026-10-21T18:04:20.000Z",
      "error_kind": null,
      "children": [],
      "tool_use": { "read_file": 1 }
    },
    {
      "run_id": "018f5b3e-cccc-7ccc-8ccc-cccccccccccc",
      "parent_run_id": "018f5b3e-aaaa-7aaa-8aaa-aaaaaaaaaaaa",
      "root_run_id": "018f5b3e-aaaa-7aaa-8aaa-aaaaaaaaaaaa",
      "depth": 0,
      "name": "read_a",
      "mode": "react",
      "status": "running",
      "phase": "join",
      "iteration": 1,
      "max_iterations": 8,
      "task_sha256_12": "111122223333",
      "task_title": "Read the login handler",
      "spec_id": "coder",
      "started_at": "2026-10-21T18:04:21.000Z",
      "finished_at": null,
      "error_kind": null,
      "children": [
        { "run_id": "018f5b3e-eeee-7eee-8eee-eeeeeeeeeeee", "name": "helper", "status": "running", "depth": 1 }
      ],
      "tool_use": { "read_file": 1, "spawn_subagents": 1 }
    },
    {
      "run_id": "018f5b3e-dddd-7ddd-8ddd-dddddddddddd",
      "parent_run_id": "018f5b3e-aaaa-7aaa-8aaa-aaaaaaaaaaaa",
      "root_run_id": "018f5b3e-aaaa-7aaa-8aaa-aaaaaaaaaaaa",
      "depth": 0,
      "name": "read_b",
      "mode": "react",
      "status": "running",
      "phase": "react",
      "iteration": 1,
      "max_iterations": 8,
      "task_sha256_12": "444455556666",
      "task_title": "Read the redirect target",
      "spec_id": "coder",
      "started_at": "2026-10-21T18:04:21.000Z",
      "finished_at": null,
      "error_kind": null,
      "children": [],
      "tool_use": { "read_file": 1 }
    },
    {
      "run_id": "018f5b3e-eeee-7eee-8eee-eeeeeeeeeeee",
      "parent_run_id": "018f5b3e-cccc-7ccc-8ccc-cccccccccccc",
      "root_run_id": "018f5b3e-aaaa-7aaa-8aaa-aaaaaaaaaaaa",
      "depth": 1,
      "name": "helper",
      "mode": "react",
      "status": "running",
      "phase": "react",
      "iteration": 1,
      "max_iterations": 8,
      "task_sha256_12": "777788889999",
      "task_title": "Extract the redirect constant",
      "spec_id": "coder",
      "started_at": "2026-10-21T18:04:30.000Z",
      "finished_at": null,
      "error_kind": null,
      "children": [],
      "tool_use": { "read_file": 1 }
    }
  ],
  "tools": [
    { "name": "read_file", "source": "builtin", "enabled": true },
    { "name": "write_file", "source": "builtin", "enabled": true },
    { "name": "list_dir", "source": "builtin", "enabled": true },
    { "name": "finish", "source": "builtin", "enabled": true },
    { "name": "spawn_subagents", "source": "builtin", "enabled": true }
  ],
  "mcp_servers": [
    {
      "name": "fs",
      "transport": "stdio",
      "command": "npx",
      "status": "down",
      "required": false,
      "tool_count": 0,
      "tools_skipped": 0,
      "restart_count": 2,
      "connected_at": null,
      "last_error": "stdio child exited status 1"
    }
  ],
  "limits": { "max_subagent_depth": 2, "max_fanout": 8, "live_subagents": 3 }
}
